"id","title","author","created_utc","score","num_comments","upvote_ratio","url","domain","keywords","topics","image_text"
"1nbkecg","A single fecal transplant provides years of health benefits A capsule full of healthy gut bacteria provided obese teens with health benefits for years","user_3993","2025-09-08 03:46:57","1585","193","0.90","https://newatlas.com/health-wellbeing/fecal-microbiota-transplant-obese-adolescents/","newatlas.com","benefits, health, bacteria, years, transplant, teens, gut, fecal transplant","General",
"1nbp5k7","No wearables needed researchers use WiFi and Raspberry Pi to measure your heart rate in real time Matching clinical accuracy within seconds","user_3993","2025-09-08 07:25:32","376","26","0.95","https://www.techspot.com/news/109367-no-wearables-needed-researchers-use-wifi-raspberry-pi.html","techspot.com","seconds, researchers, raspberry, heart, clinical, real, measure, accuracy","General",
"1ncfd3g","Bottlebrush particles deliver big chemotherapy payloads directly to cancer cells Outfitted with antibodies that guide them to the tumor site the new nanoparticles could reduce the side effects of treatment","user_3993","2025-09-09 03:36:56","658","11","0.96","https://news.mit.edu/2025/bottlebrush-particles-deliver-big-chemotherapy-payloads-directly-cancer-cells-0909","news.mit.edu","tumor, reduce, antibodies, directly, effects, cells, guide, nanoparticles reduce","General",
"1ncftmh","Glue gun prints bone grafts directly onto fractures during surgery A modified glue gun prints bone grafts directly onto fractures during surgery","user_3993","2025-09-09 04:03:03","854","36","0.96","https://newatlas.com/medical-tech/3d-printed-bone-grafts-directly/","newatlas.com","surgery, bone, fractures, glue, directly, grafts, gun, prints","General",
"1ncimc4","Scientists create solar cells that generate energy from indoor light at record efficiency","user_6857","2025-09-09 06:15:17","1530","62","0.97","https://www.techspot.com/news/109369-scientists-create-solar-cells-generate-energy-indoor-light.html","techspot.com","efficiency, energy, light, cells, generate, indoor, record, create","General",
"1ncklut","China s CATL launches new sodium ion battery brand","user_8467","2025-09-09 07:34:56","13","0","0.89","https://www.reuters.com/technology/chinese-battery-maker-catl-launches-second-generation-fast-charging-battery-2025-04-21/","reuters.com","ion, launches, sodium, battery, brand, catl, china","General",
"1ndb43u","World s first koala chlamydia vaccine approved for rollout across country Vaccine will protect koalas from the widespread disease that causes painful urinary tract infections infertility blindness and death","user_3993","2025-09-10 04:02:57","4086","180","0.99","https://newatlas.com/infectious-diseases/worlds-first-koala-chlamydia-vaccine/","newatlas.com","disease, koala, vaccine, approved, painful, infections, rollout, koalas","General",
"1ndesvx","Artificial cartilage senses arthritis pain then morphs to block it A squishy cartilage like material can be loaded up with either long term or short term pain killers that are released when the material senses chemical stress from arthritis","user_3993","2025-09-10 06:52:17","635","20","0.96","https://newatlas.com/chronic-pain/artificial-cartilage-arthritis/","newatlas.com","material, cartilage, arthritis, released, morphs, killers, short, term","General",
"1ndv9lw","Breakthrough 3D printing methods bring artificial skin tissue closer to reality Swedish research team pioneers methods to print skin with functioning blood vessels","user_3993","2025-09-10 17:48:44","622","18","0.97","https://www.techspot.com/news/109411-breakthrough-3d-printing-methods-bring-artificial-skin-tissue.html","techspot.com","skin, methods, blood, research, artificial, print, printing, tissue","General",
"1ne7bwn","Technology originating at MIT leads to approved bladder cancer treatment","user_6857","2025-09-11 05:21:01","1641","26","0.98","https://news.mit.edu/2025/technology-originating-at-mit-approved-bladder-cancer-treatment-0911","news.mit.edu","treatment, mit, approved, leads, originating, technology, bladder, cancer","General",
"1ne8b3m","Scientists unlock way to harness terahertz light for advanced technologies New light control method may lead to faster wireless and quantum devices","user_3993","2025-09-11 06:05:42","256","6","0.96","https://www.techspot.com/news/109414-scientists-unlock-way-harness-terahertz-light-advanced-technologies.html","techspot.com","devices, light, lead, wireless, control, technologies, method, scientists","General",
"1neuqhm","Japan s green light for making human embryos from stem cells takes us into uncharted territory using CRISPR IPSCs and IVF potentially changing our entire species","user_3991","2025-09-11 22:18:32","44","5","0.95","https://www.statnews.com/2025/08/13/japan-human-embryos-stem-cells-controversy-ethics/","statnews.com","entire, stem, human, ipscs, potentially, territory, light, japan green","General",
"1nez3ay","Promising new epilepsy drug delivers 80 reduction in seizures Adults with drug resistant focal onset seizures are the target of experimental epilepsy drug RAP 219","user_3993","2025-09-12 02:59:12","1137","42","0.98","https://newatlas.com/disease/epilepsy-drug-reduction-seizures/","newatlas.com","drug, epilepsy, reduction, seizures, adults, resistant, rap, experimental","General",
"1nf0aip","DNA cassette tape can store every song ever recorded with petabytes to spare For now DNA based storage is still extremely slow for potential industry applications","user_3993","2025-09-12 04:09:10","197","15","0.92","https://www.techspot.com/news/109423-dna-cassette-tape-can-store-every-song-ever.html","techspot.com","dna, song, spare, industry, slow, storage, store, applications","General",
"1nf0bkg","New electric car battery could last 600 000 miles and recharge in minutes","user_3993","2025-09-12 04:10:43","562","73","0.85","https://www.techspot.com/news/109428-new-electric-car-battery-could-last-600000-miles.html","techspot.com","minutes, battery, miles, recharge, car, electric","General",
"1nf1scf","We ve glimpsed the secret quantum landscape inside all matter","user_8785","2025-09-12 05:23:55","478","38","0.94","https://www.newscientist.com/article/2494508-weve-glimpsed-the-secret-quantum-landscape-inside-all-matter/","newscientist.com","matter, glimpsed, landscape, inside, quantum, secret","General",
"1nf228z","This MIT spinout is taking biomolecule storage out of the freezer","user_6857","2025-09-12 05:36:50","163","4","0.94","https://news.mit.edu/2025/mit-spinout-cache-dna-takes-biomolecule-storage-out-freezer-0912","news.mit.edu","storage, freezer, mit, spinout, biomolecule, taking","General",
"1nf4ycf","Lidar helps gas industry find methane leaks and avoid costly losses Lincoln Laboratory transitioned its optical amplifier technology to Bridger Photonics for commercialization enhancing U S energy security and efficiency","user_3993","2025-09-12 07:37:03","235","8","0.93","https://news.mit.edu/2025/lidar-helps-gas-industry-find-methane-leaks-avoid-costly-losses-0912","news.mit.edu","security, leaks, photonics, optical, industry, costly, laboratory, lidar","General",
"1nfc6ub","New pathway engineered into plants lets them suck up more CO2 Engineered pathway lets carbon be plugged directly into key metabolic pathways","user_3993","2025-09-12 12:19:58","540","29","0.96","https://arstechnica.com/science/2025/09/new-pathway-engineered-into-plants-lets-them-suck-up-more-co%e2%82%82/","arstechnica.com","pathways, pathway, engineered, suck, lets, plants, directly, plugged","General",
"1nftx81","Shell promises 10 minute EV charging with its magical battery fluid Shell s thermal management fluid could unlock significantly faster charging for tomorrow s EVs","user_3993","2025-09-13 03:16:55","740","111","0.93","https://newatlas.com/automotive/shell-10-minute-ev-charging-battery-fluid/","newatlas.com","evs, battery, fluid, significantly, charging, minute, shell, unlock","General",
"1nfwltc","Lidar helps gas industry find methane leaks and avoid costly losses","user_6857","2025-09-13 05:45:56","928","29","0.97","https://news.mit.edu/2025/lidar-helps-gas-industry-find-methane-leaks-avoid-costly-losses-0912","news.mit.edu","costly, leaks, industry, losses, avoid, methane, gas, helps","General",
"1ngrj9k","New RNA tool to advance cancer and infectious disease research and treatment","user_6857","2025-09-14 06:37:50","1190","36","0.97","https://news.mit.edu/2025/new-rna-tool-advance-cancer-infectious-disease-research-treatment-0911","news.mit.edu","research, treatment, advance, cancer, rna, tool, disease, infectious","General",
"1nhil2u","Eye drops could replace glasses or surgery for longsightedness study says Research shows most patients can read extra lines on eye test charts after twice daily treatment","user_3993","2025-09-15 03:52:59","1148","65","0.97","https://www.theguardian.com/society/2025/sep/14/eye-drops-could-replace-glasses-surgery-longsighted-study","theguardian.com","eye, replace, lines, twice, surgery, test, shows, study","General",
"1nhlmzx","New system dramatically speeds the search for polymer materials","user_6857","2025-09-15 06:19:14","78","3","0.87","https://news.mit.edu/2025/new-system-dramatically-speeds-polymer-materials-search-0728","news.mit.edu","speeds, dramatically, search, materials, polymer","General",
"1nhofa0","Saab s compact Nimbrix missile takes down drone swarms Inexpensive system for handling small drones individually or in swarms at a range of up to 2 7 nautical miles 3 1 miles 5 km","user_3993","2025-09-15 08:07:48","215","20","0.93","https://newatlas.com/military/saab-nimbrix-anti-drone-swarms/","newatlas.com","range, miles, nautical, swarms, inexpensive, individually, handling, nimbrix","General",
"1ni2n9i","Inexpensive New Water Based Liquid Battery Could Replace 10 000 Lithium Systems","user_3991","2025-09-15 17:13:48","1215","39","0.95","https://scitechdaily.com/inexpensive-new-liquid-battery-could-replace-10000-lithium-systems/","scitechdaily.com","replace, based, lithium, systems, battery, inexpensive, liquid, water","General",
"1nic539","FDA approves first nasal spray diuretic for heart liver and kidney disease Aiming to prevent a common and costly issue that results in more than a million hospitalizations each year","user_3993","2025-09-16 01:49:46","729","25","0.97","https://newatlas.com/disease/fda-nasal-spray-heart-liver-kidney-diseases/","newatlas.com","hospitalizations, costly, results, aiming, nasal, prevent, diuretic, fda","General",
"1nifjnm","Caged drugs still STING cancer but make treatment much safer The new drug delivery system only activates when inside a tumor and calls upon the body s own immune system to destroy it","user_3993","2025-09-16 05:04:07","611","16","0.97","https://newatlas.com/cancer/caged-drugs-cancer/","newatlas.com","inside, safer, drug, body, calls, destroy, immune, sting","General",
"1nig9pg","Machine learning tool gives doctors a more detailed 3D picture of fetal health","user_6857","2025-09-16 05:37:14","120","3","0.85","https://news.mit.edu/2025/machine-learning-tool-gives-doctors-more-detailed-3d-picture-fetal-health-0915","news.mit.edu","health, picture, gives, detailed, doctors, fetal, learning, machine","General",
"1nixv6a","A new study shows that a personalized precise form of brain stimulation HD tDCS can rapidly ease depression symptoms and even reduce anxiety offering a promising drug free alternative with only mild side effects","user_3993","2025-09-16 16:53:48","1374","99","0.97","https://newatlas.com/mental-health/hd-tdcs-brain-stimulation-precise-depression/","newatlas.com","effects, rapidly, reduce, free, symptoms, shows, stimulation, personalized","General",
"1nj9tsv","MIT geologists discover where energy goes during an earthquake Based on mini lab quakes in a controlled setting the findings could help researchers assess the vulnerability of quake prone regions","user_3993","2025-09-17 03:52:05","439","9","0.97","https://news.mit.edu/2025/mit-geologists-discover-where-energy-goes-during-earthquake-0916","news.mit.edu","based, help, quake, setting, lab, mit, quakes, mini","General",
"1nj9xeu","Hunger blocking exercise molecule drives weight loss without workouts And the good news is that it could be harnessed as a therapeutic providing the same benefits without the hard work it takes to produce it naturally","user_3993","2025-09-17 03:57:44","347","94","0.92","https://newatlas.com/disease/obesity/exercise-fat-loss-metabolite/","newatlas.com","harnessed, loss, therapeutic, produce, benefits, hard, molecule, hunger","General",
"1nja4p6","Easy test identifies high stress levels in kids living with chronic illness By testing for the stress hormone cortisol in hair researchers can identify kids with chronic illness who face the greatest risk of anxiety depression or behavioral struggles","user_3993","2025-09-17 04:08:20","953","58","0.96","https://newatlas.com/medical/hair-cortisol-concentration-children-chronic-illness/","newatlas.com","illness, kids, cortisol, researchers, stress, chronic, anxiety, risk","General",
"1nje9yl","Lighting like pulses turn toxic red mud into building materials Researchers have figured out a way to send electric pulses through the mud to purify it and allow it to be reused instead of discarded","user_3993","2025-09-17 07:12:55","403","22","0.93","https://newatlas.com/materials/red-mud-purification/","newatlas.com","mud, allow, figured, pulses, purify, electric, materials, turn","General",
"1njwn3i","Meta launches smart glasses with built in display reaching for superintelligence","user_8224","2025-09-17 19:33:37","0","7","0.32","https://www.reuters.com/business/media-telecom/meta-launches-smart-glasses-with-built-in-display-reaching-superintelligence-2025-09-18/","reuters.com","superintelligence, glasses, built, display, reaching, launches, meta, smart","General",
"1nk47j5","Swarming drones could overwhelm air defenses changing the future of combat New AI software allows drones to fly and fight as one coordinated force","user_3786","2025-09-18 03:04:32","448","51","0.93","https://www.techspot.com/news/109476-swarming-drones-could-overwhelm-air-defenses-changing-future.html","techspot.com","drones, combat, fight, overwhelm, changing, fly, future, coordinated","General",
"1nk4xv9","Common daily pill slashes colorectal cancer s return by 55 A study involving more than 1 000 cancer patients has found that a low dose of aspirin halves the risk of colorectal tumors returning after surgery","user_3993","2025-09-18 03:47:41","1215","33","0.97","https://newatlas.com/cancer/medicine-colorectal-cancer/","newatlas.com","patients, involving, dose, halves, cancer, returning, colorectal, return","General",
"1nl00hb","AI designed viruses are here and already killing bacteria Can AI create a life form These generative genomes are a start","user_3786","2025-09-19 03:34:33","37","9","0.75","https://www.technologyreview.com/2025/09/17/1123801/ai-virus-bacteriophage-life/","technologyreview.com","create, form, start, bacteria, designed, generative, genomes, killing","General",
"1nl08em","By knocking out a protein duo s bodyguard role researchers have exposed a hidden weakness in pancreatic cancer It s a discovery that could lead to smarter more effective treatments for one of the deadliest cancers","user_3993","2025-09-19 03:47:50","1391","42","0.98","https://newatlas.com/disease/pancreatic-cancer-redox-protein-discovery/","newatlas.com","discovery, lead, knocking, researchers, effective, hidden, pancreatic, exposed","General",
"1nl08s9","Apollo laser takes down 200 drones unplugged","user_3993","2025-09-19 03:48:23","687","48","0.97","https://newatlas.com/military/apollo-laser-drones-weapon/","newatlas.com","unplugged, drones, apollo, laser, takes","General",
"1nlwupn","A more precise way to edit the genome","user_6857","2025-09-20 05:26:10","463","30","0.94","https://news.mit.edu/2025/more-precise-way-edit-genome-0917","news.mit.edu","edit, genome, precise","General",
"1nmo912","Key HIV weakness could pave way for a cure Scientists now know how HIV integrates into the human genome","user_3993","2025-09-21 03:12:56","1760","65","0.98","https://newatlas.com/disease/hiv-integration-genome-discovery-functional-cure/","newatlas.com","genome, scientists, pave, hiv, cure, human, integrates, know","General",
"1nmo9nl","Magnesium the microbiome and reducing the risk of colon cancer Magnesium supplements may prevent colon cancer by boosting specific gut bacteria","user_3993","2025-09-21 03:14:06","951","72","0.96","https://newatlas.com/health-wellbeing/magnesium-supplements-gut-bacteria-colorectal-cancer/","newatlas.com","cancer, magnesium, risk, colon, specific, microbiome, reducing, boosting specific","General",
"1nnjbfk","Ozempic killer New drug reprograms metabolism for lasting weight loss A new drug targets weight loss differently leading to a more permanent fat shedding solution","user_3993","2025-09-22 03:57:21","1821","278","0.96","https://newatlas.com/disease/obesity/weight-loss-drug/","newatlas.com","drug, loss, permanent, solution, weight, ozempic, reprograms, differently","General",
"1nnjgy0","New tool makes generative AI models more likely to create breakthrough materials With SCIGEN researchers can steer AI models to create materials with exotic properties for applications like quantum computing","user_3993","2025-09-22 04:05:22","68","0","0.81","https://news.mit.edu/2025/new-tool-makes-generative-ai-models-likely-create-breakthrough-materials-0922","news.mit.edu","materials, create, models, generative, properties, quantum, steer, applications","General",
"1nno65z","New biodegradable film made from onion skins can boost solar panel lifespan Renewable solar cell filters stay effective after simulated year of use","user_3993","2025-09-22 07:35:14","227","1","0.93","https://www.techspot.com/news/109560-new-bio-based-film-made-onion-skins-helps.html","techspot.com","solar, skins, simulated, filters, biodegradable, film, effective, onion","General",
"1nnokr8","Inflammation jolts sleeping cancer cells awake enabling them to multiply again","user_6857","2025-09-22 07:50:31","553","48","0.95","https://news.mit.edu/2025/inflammation-jolts-sleeping-cancer-cells-awake-0918","news.mit.edu","multiply, enabling, cancer, awake, cells, inflammation, jolts, sleeping","General",
"1noefxk","Tumor targeting Salmonella engineered to boost colon cancer survival Scientists have engineered a species of Salmonella that self destructs inside colon cancer tumors","user_3993","2025-09-23 04:09:00","1216","38","0.98","https://newatlas.com/disease/engineered-salmonella-lysis-colorectal-tumor-treatment/","newatlas.com","cancer, engineered, colon, scientists, salmonella, destructs, boost, species","General",
"1nogke2","New nonstick coating acts like Teflon but without the forever chemicals","user_6857","2025-09-23 05:52:26","736","67","0.92","https://newatlas.com/materials/new-nonstick-material/","newatlas.com","forever, acts, chemicals, teflon, coating, nonstick","General",
"1noixxi","Smartphone Cameras Go Hyperspectral Off the shelf smartphone cameras can become advanced sensors","user_3993","2025-09-23 07:30:04","109","6","0.93","https://spectrum.ieee.org/hyperspectral-imaging","spectrum.ieee.org","sensors, hyperspectral, shelf, cameras, smartphone, advanced","General",
"1np8wdt","Nano cubosome eyedrops that can ferry protective compounds all the way to the retina target macular degeneration without needles","user_3993","2025-09-24 03:49:10","1395","32","0.98","https://newatlas.com/aging/new-eyedrop-retina-conditions/","newatlas.com","needles, protective, macular, compounds, ferry, degeneration, retina, cubosome","General",
"1np8ych","Enzyme behind diet induced obesity and diabetes can be switched off Switching off an enzyme in mice prevented diet induced obesity and improved metabolism","user_3993","2025-09-24 03:52:22","1004","81","0.97","https://newatlas.com/disease/obesity/camkk2-enzyme-switch-obesity-metabolism/","newatlas.com","enzyme, induced, diet, switched, diabetes, obesity, switching, improved","General",
"1npa4ma","MIT engineers develop a magnetic transistor for more energy efficient electronics A new device concept opens the door to compact high performance transistors with built in memory","user_3993","2025-09-24 04:56:38","276","7","0.94","https://news.mit.edu/2025/mit-engineers-develop-magnetic-transistor-more-energy-efficient-electronics-0923","news.mit.edu","performance, built, opens, efficient, device concept, memory, door, electronics","General",
"1npca5j","World s first behavior transplant between species achieved","user_6857","2025-09-24 06:33:51","404","82","0.94","https://newatlas.com/biology/unknown-behavior-gene-transfer/","newatlas.com","behavior, species, achieved, transplant","General",
"1nq413j","Study shows mucus contains molecules that block Salmonella infection MIT researchers now hope to develop synthetic versions of these molecules which could be used to treat or prevent foodborne illnesses","user_3993","2025-09-25 04:18:59","1053","35","0.98","https://news.mit.edu/2025/study-shows-mucus-contains-molecules-that-block-salmonella-infection-0925","news.mit.edu","molecules, synthetic, hope, prevent, block, contains, mit, treat","General",
"1nq62zh","GE Aerospace flies hypersonic engine with no moving parts","user_6857","2025-09-25 05:58:24","607","62","0.96","https://newatlas.com/military/ge-hypersonic-ramjet-engine-flight/","newatlas.com","hypersonic, engine, moving, parts, aerospace, flies","General",
"1nqymrk","AI system learns from many types of scientific information and runs experiments to discover new materials","user_3993","2025-09-26 04:17:26","109","5","0.80","https://news.mit.edu/2025/ai-system-learns-many-types-scientific-information-and-runs-experiments-discovering-new-materials-0925","news.mit.edu","materials, learns, types, discover, experiments, information, runs, scientific","General",
"1nqyn0x","Technique makes complex 3D printed parts more reliable New research enables computer designs to incorporate the limitations of 3D printers to better control materials performance in aerospace medical and other applications","user_3993","2025-09-26 04:17:51","404","5","0.93","https://news.mit.edu/2025/technique-makes-complex-3d-printed-parts-more-reliable-0925","news.mit.edu","applications, designs, better, research, medical, performance, makes complex, technique","General",
"1nr1pdn","Device uses a camera AI and electricity to boost healing time by 25","user_6857","2025-09-26 06:42:47","269","21","0.85","https://newatlas.com/medical-devices/a-heal-speeds-healing/","newatlas.com","healing, electricity, camera, boost, device, uses","General",
"1nrs7xz","Durable steel wheels could replace rubber tires on mining vehicles GACW says its Air Suspension Wheels can last as long as the vehicles they re fitted on and save up to 60 of what you d spend refitting tires on them over that time","user_3993","2025-09-27 03:52:01","685","44","0.95","https://newatlas.com/automotive/gacw-steel-wheels-rubber-tires-mining-vehicles-asw/","newatlas.com","vehicles, wheels, spend, tires, save, says, steel, air","General",
"1nrs99u","New AI system could accelerate clinical research By enabling rapid annotation of areas of interest in medical images the tool can help scientists study new treatments or map disease progression","user_3993","2025-09-27 03:54:19","93","4","0.84","https://news.mit.edu/2025/new-ai-system-could-accelerate-clinical-research-0925","news.mit.edu","areas, map, research, rapid, help, accelerate, progression, treatments","General",
"1nruk28","New 3D bioprinting technique may improve production of engineered tissue","user_6857","2025-09-27 05:56:28","182","3","0.92","https://news.mit.edu/2025/new-3d-bioprinting-technique-may-improve-production-engineered-tissue-0917","news.mit.edu","tissue, technique, production, bioprinting, engineered, improve","General",
"1nrvk3j","Slime mold meets encryption in a radical art experiment SlimeMoldCrypt turns a biological process into a quantum resistant encryption machine","user_3993","2025-09-27 06:41:46","354","24","0.93","https://www.techspot.com/news/109648-slimemoldcrypt-turns-biological-process-quantum-resistant-encryption-machine.html","techspot.com","encryption, radical, biological, slimemoldcrypt, machine, process, art, experiment slimemoldcrypt","General",
"1nsnjej","Microwave weapon downs 49 drones with a single blast In a demonstration not so much of marksmanship but more of the advantages of microwaves","user_3993","2025-09-28 05:50:27","1270","101","0.98","https://newatlas.com/military/microwave-beam-anti-drone-weapon/","newatlas.com","advantages, demonstration, drones, marksmanship, microwaves, blast, single, downs","General",
"1nsnjy0","UV light is a fast effective way to deactivate indoor airborne allergens UV222 light is a passive quick way to inactivate indoor airborne allergens like cat dander","user_3993","2025-09-28 05:51:12","406","25","0.87","https://newatlas.com/health-wellbeing/uv222-light-indoor-airborne-allergens-deactivate/","newatlas.com","light, indoor, airborne, allergens, deactivate, inactivate, cat, dander","General",
"1nsnyq5","Bottlebrush particles deliver big chemotherapy payloads directly to cancer cells","user_6857","2025-09-28 06:10:39","421","13","0.98","https://news.mit.edu/2025/bottlebrush-particles-deliver-big-chemotherapy-payloads-directly-cancer-cells-0909","news.mit.edu","cells, directly, cancer, chemotherapy, payloads, bottlebrush, deliver, particles","General",
"1ntgxhg","Low dose radiation relieves knee osteoarthritis pain improves function","user_6857","2025-09-29 05:40:17","1139","94","0.97","https://newatlas.com/disease/knee-osteoarthritis-low-dose-radiation-clinical-trial/","newatlas.com","pain, relieves, function, improves, knee, osteoarthritis, dose, low","General",
