"id","title","author","created_utc","score","num_comments","upvote_ratio","url","domain","keywords","topics","image_text"
"1nuce6u","Spider like construction robot promises to build a home per day Being autonomously capable of building a 2 150 sq ft home in a single day operating at roughly the speed of 100 bricklayers","user_3993","2025-09-30 05:53:25","877","126","0.94","https://newatlas.com/robotics/crest-earthbuilt-charlotte-construction-robot/","newatlas.com","home, autonomously, bricklayers, building, build, single, speed, robot","General",
"1nucil7","A boost for the precision of genome editing","user_6857","2025-09-30 05:58:54","133","1","0.91","https://news.mit.edu/2025/boost-precision-genome-editing-0820","news.mit.edu","boost, genome, editing, precision","General",
"1nuwsa7","Study finds key role for non neural brain cells in processing vision MIT researchers employed a novel application of tools and analysis to show that astrocytes ensure neural information processing by maintaining ambient levels of the neurotransmitter chemical GABA","user_3993","2025-09-30 19:42:45","447","26","0.96","https://news.mit.edu/2025/study-finds-key-role-non-neural-brain-cells-processing-vision-0930","news.mit.edu","neural, levels, analysis, role, neurotransmitter, processing, mit, novel","General",
"1nv6bxv","Oak Ridge s new 3D printer can mix and match materials at massive scale Scientists unveil multiplexed nozzle for next generation 3D printing","user_3993","2025-10-01 05:04:48","567","20","0.95","https://www.techspot.com/news/109690-oak-ridge-new-3d-printer-can-mix-match.html","techspot.com","generation, printer, printing, match, unveil, massive, oak ridge, ridge","General",
"1nv7jq1","Artificial neuron melds electronics and biology to function like the real thing","user_6857","2025-10-01 06:00:28","498","43","0.95","https://newatlas.com/medical-tech/artificial-neuron-mimic-reality-bioelectronics/","newatlas.com","function, electronics, biology, real, thing, artificial, melds, neuron","General",
"1nvjz4n","Edible sensor warns of flu by tasting like thyme The molecular sensor contains a phenolic compound called thymol which is found in thyme","user_3993","2025-10-01 13:44:18","641","27","0.95","https://newatlas.com/infectious-diseases/edible-flu-sensor-tastes-like-thyme/","newatlas.com","thyme, tasting, sensor, contains, compound, flu, molecular, edible","General",
"1nvzkbv","Notorious Alzheimer s protein also supercharges cells against cancer Scientists have found that a byproduct of amyloid beta rejuvenates T cells boosting their tumor fighting power and dramatically reducing cancer risk","user_3993","2025-10-02 02:57:30","1293","57","0.97","https://newatlas.com/disease/amyloid-beta-protein-t-cells-mitophagy-cancer/","newatlas.com","scientists, rejuvenates, risk, cells, boosting, fighting, cancer, dramatically","General",
"1nw0fgn","Palladium filters could enable cheaper more efficient generation of hydrogen fuel The novel design allows the membranes to withstand high temperatures when separating hydrogen from gas mixtures","user_3993","2025-10-02 03:48:06","172","15","0.90","https://news.mit.edu/2025/palladium-filters-could-enable-cheaper-more-efficient-generation-hydrogen-fuel-1001","news.mit.edu","hydrogen, efficient, enable, withstand, novel, temperatures, generation, separating","General",
"1nw2k8b","This chip uses light to supercharge AI and cut energy use","user_6857","2025-10-02 05:35:54","86","4","0.83","https://newatlas.com/materials/light-based-chip-ai-power-efficiency/","newatlas.com","energy, light, cut, supercharge, chip, uses","General",
"1nw5nqm","MIT s concrete battery just got 10 times more powerful Researchers found a way to combine cement water and carbon black to create a supercapacitor expanding the storage capacity by nearly 10 times","user_3993","2025-10-02 07:41:18","1042","53","0.97","https://newatlas.com/energy/mit-concrete-battery-powerful-supercapacitor/","newatlas.com","combine, times, powerful, nearly, supercapacitor, battery, storage, create supercapacitor","General",
"1nwvnsp","Next gen imaging tech could catch sight stealing diseases early A powerful new imaging tool offers unprecedented 3D vision of the retina","user_3993","2025-10-03 03:43:50","413","7","0.96","https://newatlas.com/medical-tech/dual-imaging-technology-retinal-oxygen-metabolism/","newatlas.com","retina, vision, early, tech, imaging, offers, sight, powerful","General",
"1nwzuea","NASA moon rover project pushes extreme battery tech to its limits","user_6857","2025-10-03 06:55:30","588","8","0.96","https://newatlas.com/space/gm-battery-tech-lunar-rover/","newatlas.com","limits, battery, project, tech, extreme, pushes, moon, nasa","General",
"1nxscj6","A groundbreaking study has revealed that your mom and dad s DNA don t just pass on telomere length they actively reshape it in the first days of life influencing how we age and our risk of developing diseases such as cancer","user_3993","2025-10-04 05:13:14","1354","74","0.96","https://newatlas.com/health-wellbeing/parental-dna-telomere-length-offspring/","newatlas.com","reshape, dad, length, influencing, revealed, risk, don, pass","General",
"1nxv83p","Parachutes with hundreds of holes could enable safer drone deliveries","user_6857","2025-10-04 07:19:10","224","31","0.87","https://newatlas.com/drones/parachute-holes-kirigami-airdrops-drone-deliveries/","newatlas.com","deliveries, enable, holes, hundreds, parachutes, drone, safer","General",
"1nynmwe","Psychedelic DMT shows promise as breakthrough stroke treatment","user_6857","2025-10-05 06:02:45","1730","127","0.97","https://newatlas.com/disease/dmt-stroke-treatment-brain-inflammation-recovery/","newatlas.com","stroke, promise, treatment, breakthrough, dmt, psychedelic, shows","General",
"1nz23sa","Scientists race to make living computers powered by human cells","user_3840","2025-10-05 15:27:25","267","82","0.87","https://www.bbc.com/news/articles/cy7p1lzvxjro","bbc.com","cells, powered, race, scientists, human, computers, living","General",
"1nzfaht","Sugar switch in the brain offers new path to treating depression Removing the St3gal1 enzyme in healthy mice caused depressive symptoms increasing St3gal1 in stressed mice had the opposite effect easing those behaviors","user_3993","2025-10-06 03:25:21","708","39","0.96","https://newatlas.com/mental-health/brain-sugars-depression/","newatlas.com","mice, easing, treating, caused, stressed, increasing, offers, behaviors","General",
"1nzfd73","Smart in asphalt fabric provides live reports from within roads Once embedded in the asphalt the sensor fabric s job is to provide continuous measurements","user_3993","2025-10-06 03:29:58","90","3","0.88","https://newatlas.com/good-thinking/electronic-fabric-asphalt-roads/","newatlas.com","asphalt, fabric, measurements, roads, job, reports, sensor, embedded","General",
"1nzfgso","Chemists create red fluorescent dyes that may enable clearer biomedical imaging The new dyes are based on boron containing molecules that were previously too unstable for practical use","user_3993","2025-10-06 03:35:50","432","7","0.96","https://news.mit.edu/2025/chemists-create-red-fluorescent-dyes-may-enable-clearer-biomedical-imaging-1006","news.mit.edu","biomedical, unstable, containing, dyes, based, fluorescent, imaging, molecules","General",
"1nzfpoi","How Wi Fi Signals Can Be Used to Detect Your Heartbeat Contactless pulse monitoring opens up new wearable possibilities","user_3993","2025-10-06 03:50:06","201","10","0.92","https://spectrum.ieee.org/wi-fi-signal-heartbeat-detection","spectrum.ieee.org","signals, possibilities, used, pulse, detect, wearable, contactless, heartbeat","General",
"1nzmd2l","Ocean CO2 becomes sustainable plastic thanks to modified microbes Turning dissolved carbon dioxide from seawater to biodegradable plastic is an especially powerful way to clean up the ocean","user_3993","2025-10-06 08:33:50","991","38","0.97","https://newatlas.com/environment/ocean-co2-sustainable-plastic-doc/","newatlas.com","ocean, clean, dioxide, powerful, plastic, turning, sustainable, biodegradable","General",
"1o0b42k","Tiny lab grown brains could help build the next generation of computers Biocomputing has left the realm of science fiction and entered the laboratory","user_3993","2025-10-07 03:35:00","273","69","0.87","https://www.techspot.com/news/109753-tiny-lab-grown-brains-could-help-build-next.html","techspot.com","generation, biocomputing, build, entered, science, brains, laboratory, left","General",
"1o0dk1n","Printable aluminum alloy sets strength records may enable lighter aircraft parts","user_6857","2025-10-07 05:36:17","575","12","0.97","https://news.mit.edu/2025/printable-aluminum-alloy-sets-strength-records-may-enable-lighter-aircraft-parts-1007","news.mit.edu","aircraft, sets, parts, enable, lighter, records, strength, alloy","General",
"1o0i23l","New sunlight powered film kills 99 995 bacteria to provide safe drinking water It offers a simple affordable and robust solution to the global safe drinking water crisis","user_3993","2025-10-07 08:31:57","1304","50","0.97","https://www.nature.com/articles/s44221-025-00500-0","nature.com","safe, provide, film, crisis, water, drinking, offers, affordable","General",
"1o1ahsj","Breakthrough blood test detects chronic fatigue in 92 of cases","user_6857","2025-10-08 06:27:37","2056","118","0.95","https://newatlas.com/imaging-diagnostics/chronic-fatigue-accurate-blood-test/","newatlas.com","cases, detects, chronic, fatigue, blood, breakthrough, test","General",
"1o24xx8","New daily pill shows strong results in ulcerative colitis clinical trial","user_6857","2025-10-09 05:45:22","1015","53","0.97","https://newatlas.com/disease/obefazimod-daily-pill-ulcerative-colitis-clinical-trial/","newatlas.com","clinical, shows, trial, colitis, daily, pill, results, strong","General",
"1o2zyym","Next gen vaccine prevents up to 88 of multiple aggressive cancers","user_6857","2025-10-10 05:48:37","4201","170","0.99","https://newatlas.com/disease/dual-adjuvant-nanoparticle-vaccine-aggressive-cancers/","newatlas.com","prevents, aggressive, cancers, multiple, gen, vaccine","General",
"1o3vw6e","Forged in disorder High entropy MXenes emerge as a new material","user_6857","2025-10-11 06:39:09","312","17","0.90","https://newatlas.com/materials/high-entropy-mxenes-new-material/","newatlas.com","emerge, material, disorder, forged, entropy, mxenes","General",
"1o4p02i","Engineered natural killer cells could help fight cancer","user_6857","2025-10-12 06:24:47","1124","48","0.97","https://news.mit.edu/2025/engineered-natural-killer-cells-could-help-fight-cancer-1008","news.mit.edu","fight, cells, cancer, help, engineered, killer, natural","General",
"1o5j1j1","Naked mole rat DNA repair could unlock natural human longevity","user_6857","2025-10-13 06:00:12","1069","100","0.95","https://newatlas.com/aging/naked-mole-rat-longevity/","newatlas.com","longevity, unlock, dna, repair, human, natural, mole, naked","General",
"1o6eogc","Two pronged approach cuts sleep apnea events by 68","user_6857","2025-10-14 05:53:12","1072","173","0.97","https://newatlas.com/health-wellbeing/obstructive-sleep-apnea-oxygen-and-mad/","newatlas.com","events, cuts, approach, pronged, apnea, sleep","General",
"1o7adwi","Helping scientists run complex data analyses without writing code","user_6857","2025-10-15 06:02:19","329","17","0.90","https://news.mit.edu/2025/helping-scientists-run-complex-data-analyses-without-writing-code-1014","news.mit.edu","complex, code, writing, analyses, data, helping, run, scientists","General",
"1o861b4","New approach shields memory from brain cancer radiotherapy","user_6857","2025-10-16 06:23:05","513","8","0.98","https://newatlas.com/medical-tech/radiation-induced-brain-injury-complement-system/","newatlas.com","cancer, memory, radiotherapy, brain, approach, shields","General",
